{
  "schemaVersion": "0.3.0",
  "receiptId": "receipt:continuation_fixture_await_human",
  "recordState": "sealed",
  "recordedAt": "2026-08-22T12:03:30Z",
  "supersedes": null,
  "packet": {
    "id": "packet:continuation_fixture_review",
    "path": "tests/fixtures/continuation-valid/packet.json",
    "sha256": "1E5235A0DECE5998E3FCAF3A4807A5D00A09CE57922FE40E4EB6A33E3793DE11",
    "schemaVersion": "0.3.0"
  },
  "bindings": {
    "protocolBundle": {
      "id": "protocol:elad_0.3.0",
      "path": "blueprint.json",
      "sha256": "FC49D794CAAE67445BC708B6219DD463352C3561A9E8F1DD7CE5CD1CA6707873",
      "schemaVersion": "0.3.0"
    },
    "intent": {
      "id": "intent:continuation_fixture_review",
      "path": "tests/fixtures/continuation-valid/intent.json",
      "sha256": "A973BAF47CA1E273BD62F18D56C366AC5E954BAE054BD9975C9015B4DBD1D1BB",
      "schemaVersion": "0.3.0"
    },
    "projectProfile": {
      "id": "project:continuation_fixture",
      "path": "tests/fixtures/continuation-valid/project-profile.json",
      "sha256": "69A4A0375AF2B74B74601F5A133D422A2E7B5FAD9E428B85001C9EAC249AA1B7",
      "schemaVersion": "0.3.0"
    },
    "authority": {
      "id": "authority:continuation_fixture",
      "path": "tests/fixtures/continuation-valid/authority.json",
      "sha256": "DD9C7080AC12D31CBF8D10996DA6BE74B95439E5339D0B01956452C807ECE537",
      "schemaVersion": "0.3.0"
    },
    "riskPolicy": {
      "id": "risk-policy:continuation_fixture",
      "path": "tests/fixtures/continuation-valid/risk-policy.json",
      "sha256": "30056E651848A91CA7E6ED04669861015A8B8E8262B241621C060DFA634BFF17",
      "schemaVersion": "0.3.0"
    },
    "dataPolicy": {
      "id": "data-policy:continuation_fixture",
      "path": "tests/fixtures/continuation-valid/data-policy.json",
      "sha256": "68E5508A3932AA1871E14772DC867D1F4256B9D41D119BEA4E57CE707CE37E57",
      "schemaVersion": "0.3.0"
    },
    "evidencePolicy": {
      "id": "evidence-policy:continuation_fixture",
      "path": "tests/fixtures/continuation-valid/evidence-policy.json",
      "sha256": "C9F7A473A88B58B020759BC258BF4A996938EEF4723EF4FA2A7E121537D29901",
      "schemaVersion": "0.3.0"
    },
    "toolRegistry": {
      "id": "tool-registry:continuation_fixture",
      "path": "tests/fixtures/continuation-valid/tool-registry.json",
      "sha256": "C1AFCC8BE8595DB6586FB38BFE36B4CA6DC97847AA1E6C5B9DFC1706C5B0884B",
      "schemaVersion": "0.3.0"
    },
    "evaluatorRegistry": {
      "id": "evaluator-registry:continuation_fixture",
      "path": "tests/fixtures/continuation-valid/evaluator-registry.json",
      "sha256": "4E7D7DD95264144FD62F74C70A17FB17F5E1FE7216DBF45A88E979A5D7B1C604",
      "schemaVersion": "0.3.0"
    }
  },
  "riskClass": "low",
  "dataClass": "internal",
  "taskFamily": "read_only_contract_review",
  "artifactLane": "ordinary_source",
  "requestedEffects": [
    "read"
  ],
  "writer": {
    "profile": {
      "id": "writer:continuation_fixture_worker",
      "path": "tests/fixtures/continuation-valid/writer-profile.json",
      "sha256": "764C94BB323004144C48B3C8FC2F96CBB9481C928939965396B061D4F78967CB",
      "schemaVersion": "0.3.0"
    },
    "certificate": {
      "id": "certificate:continuation_fixture_worker",
      "path": "tests/fixtures/continuation-valid/capability-certificate.json",
      "sha256": "5E8DB4E2EF27DCA79FA474862F2794AEDF5F12E3C47000F5311B4424B7F2E8BD",
      "schemaVersion": "0.3.0"
    }
  },
  "terminalStatus": "COMPLETE",
  "candidate": {
    "state": "unchanged",
    "candidateId": "candidate:continuation_fixture_review",
    "candidateSha256": "E4586278E2489A2A3F4943ECCA1A367A57E86F0B1653A6B3F6A59BAF1A86F200",
    "baseHead": "ffffffffffffffffffffffffffffffffffffffff",
    "head": "ffffffffffffffffffffffffffffffffffffffff"
  },
  "changedPaths": [],
  "claims": [
    {
      "claimId": "claim:continuation_fixture_contract_matches",
      "claimClass": "claim-class:deterministic_document_identity",
      "acceptanceOwner": "machine",
      "evidenceClass": "deterministic",
      "resolvedSubject": {
        "kind": "candidate",
        "repositoryId": "repo:continuation_fixture",
        "id": "candidate:continuation_fixture_review",
        "baseHead": "ffffffffffffffffffffffffffffffffffffffff",
        "sha256": "E4586278E2489A2A3F4943ECCA1A367A57E86F0B1653A6B3F6A59BAF1A86F200"
      },
      "result": "passed",
      "evidenceRefs": [
        "evidence:continuation_fixture_candidate_output",
        "evidence:continuation_fixture_machine_result"
      ],
      "externalHumanReceipt": null
    },
    {
      "claimId": "claim:continuation_fixture_is_useful",
      "claimClass": "claim-class:subjective_product_quality",
      "acceptanceOwner": "external_human",
      "evidenceClass": "external_human",
      "resolvedSubject": {
        "kind": "candidate",
        "repositoryId": "repo:continuation_fixture",
        "id": "candidate:continuation_fixture_review",
        "baseHead": "ffffffffffffffffffffffffffffffffffffffff",
        "sha256": "E4586278E2489A2A3F4943ECCA1A367A57E86F0B1653A6B3F6A59BAF1A86F200"
      },
      "result": "not_evaluated",
      "evidenceRefs": [],
      "externalHumanReceipt": null
    }
  ],
  "evidenceManifest": {
    "id": "evidence-manifest:continuation_fixture_review",
    "path": "tests/fixtures/continuation-valid/evidence-manifest.json",
    "sha256": "BFADFE0D814B67C21B7CC0ECFC0C167C1C64A9AA06CB97BEACAEF1E3ACDAABC6",
    "schemaVersion": "0.3.0"
  },
  "openHumanClaims": [
    "claim:continuation_fixture_is_useful"
  ],
  "metrics": {
    "contextTokens": 1024,
    "outputTokens": 256,
    "retrievals": 1,
    "sequentialToolCalls": 2,
    "totalToolCalls": 2,
    "attempts": 1,
    "spawns": 0,
    "wallSeconds": 12.5,
    "costUsd": null,
    "resourceEnvelope": "resource-envelope:continuation_fixture_worker",
    "resourceObservation": "Synthetic validator observation under the exact configured resource envelope; no model or external target ran."
  },
  "firstCausalFailure": null,
  "finalizationState": "await_external_human_receipt",
  "requestedNextAction": "external_human_review"
}
